{
  "feature_snapshot_id": "fsnap_001dl0000240t62qaa_icp_fit_v1_20260508",
  "source_account_id": "001dL0000240t62QAA",
  "snapshot_as_of": "2026-05-08T00:00:00Z",
  "feature_set_version": "icp_fit_v1",
  "feature_namespace": "icp_fit",
  "point_in_time_policy": "as_of_snapshot_only",
  "features": {
    "annual_revenue_usd": 139000000,
    "employee_total": null,
    "business_category": "electronics",
    "classification_code": "ELECTRONICS",
    "firmographic_confidence": 0.72,
    "evidence_count": 4,
    "has_corporate_linkage": false
  },
  "source_refs": [
    {
      "source_type": "data_cloud_dmo",
      "source_table": "pulse360_s4.gold.firmographic_profile_export",
      "source_id": "fprof_001dl0000240t62qaa",
      "field_path": "annual_revenue_usd",
      "freshness_status": "current"
    },
    {
      "source_type": "data_cloud_dmo",
      "source_table": "pulse360_s4.gold.company_classification_export",
      "source_id": "class_001dl0000240t62qaa_industry",
      "field_path": "code",
      "freshness_status": "current"
    }
  ],
  "lineage": {
    "run_id": "run_model_plan_20260508",
    "job_name": "pulse360_account_feature_snapshot_batch",
    "input_table_versions": {
      "firmographic_profile_export": "2026-05-08",
      "company_classification_export": "2026-05-08",
      "weighted_attribute_resolution": "2026-05-08"
    },
    "created_at": "2026-05-08T00:05:00Z"
  },
  "quality": {
    "feature_completeness": 0.7,
    "evidence_coverage": 0.72,
    "conflict_count": 0,
    "activation_eligible_flag": true
  }
}
